{
  "catalog": "supply_chain",
  "schema": "supply_chain",
  "source_file_path": "/Volumes/supply_chain/supply_chain/raw_sample_files",
  "source_file_pattern": "inventory_raw.jsonl",
  "file_type": "json",
  "bronze_destination_table": "bronze_inventory",
  "schema_location": "/Volumes/supply_chain/supply_chain/raw_sample_files/_state/schemas/bronze_inventory",
  "checkpoint_path": "/Volumes/supply_chain/supply_chain/raw_sample_files/_state/checkpoints/bronze_inventory",
  "job_run_id": null,
  "reader_options": {
    "multiLine": false
  },
  "autoloader_options": {
    "cloudFiles.inferColumnTypes": true,
    "cloudFiles.schemaEvolutionMode": "addNewColumns"
  },
  "write_options": {
    "output_mode": "append",
    "trigger_available_now": true
  }
}
